{
  "schema_version": "1.0",
  "title": "The Little Town's Evening Walk",
  "fiction_label": "Fiction inspired by today's news",
  "characters": ["courier", "mayor", "pigeon"],
  "beats": [
    {"beat_index":0,"source_ref":0,"text":"A courier invites neighbors to a lantern walk through the little town."},
    {"beat_index":1,"source_ref":1,"text":"The courier checks the newly lit harbor path on the route."},
    {"beat_index":2,"source_ref":2,"text":"A map helps the group choose an accessible river loop."},
    {"beat_index":3,"source_ref":3,"text":"The market canopy becomes a cheerful meeting point."},
    {"beat_index":4,"source_ref":4,"text":"Garden seeds decorate the route markers for spring."},
    {"beat_index":5,"source_ref":5,"text":"At the clock workshop, everyone ends the walk with a shared wave.","ending":true}
  ]
}